{
  "schema": "static-os.v1-vehicle-ecm-observation/v0",
  "vehicle_ref": "fixture:vehicle-001",
  "source_adapter": "fixture:authorized-readonly-obd-adapter",
  "session_id": "fixture-drive-session-001",
  "observed_at": "2026-10-07T23:00:00Z",
  "signals": {
    "engine_rpm": {"value": 812, "unit": "rpm"},
    "vehicle_speed": {"value": 0, "unit": "km/h"},
    "coolant_temperature": {"value": 87, "unit": "degC"},
    "battery_voltage": {"value": 13.9, "unit": "V"}
  },
  "trouble_codes": []
}
